{
  "id": "tomato",
  "names": {
    "uk": "Помідор",
    "en": "Tomato"
  },
  "aliases": [
    "томат",
    "помідори",
    "помідор червоний",
    "tomatoes"
  ],
  "category": "vegetable",
  "dimensions_m": {
    "x": 0.07,
    "y": 0.056,
    "z": 0.07,
    "range": {
      "min": {
        "x": 0.055,
        "y": 0.045,
        "z": 0.055
      },
      "max": {
        "x": 0.09,
        "y": 0.072,
        "z": 0.09
      }
    }
  },
  "mass_g": {
    "avg": 130,
    "min": 80,
    "max": 220
  },
  "density_g_cm3": 0.98,
  "edible_parts": [
    "skin",
    "flesh",
    "gel",
    "seed",
    "core"
  ],
  "inedible_parts": [
    "calyx",
    "stem"
  ],
  "waste_ratio": 0.03,
  "states": {
    "whole": {
      "status": "built",
      "files": [
        {
          "name": "tomato_whole.glb",
          "lod": 0,
          "bytes": 257596,
          "triangles": 8660,
          "pieces": 1,
          "piece_mass_g": 149.4,
          "mass_total_g": 149.4,
          "piece_size_mm": [
            70.4,
            70.4,
            64.7
          ]
        }
      ],
      "piece_count": 1,
      "piece_mass_g": 149.4,
      "piece_size_mm": {
        "x": 70.4,
        "y": 70.4,
        "z": 64.7
      }
    },
    "half": {
      "status": "built",
      "variants": [
        "half",
        "half_cross"
      ],
      "files": [
        {
          "name": "tomato_half.glb",
          "lod": 0,
          "bytes": 1240572,
          "triangles": 43992,
          "pieces": 2,
          "piece_mass_g": 74.72,
          "mass_total_g": 149.4,
          "piece_size_mm": [
            65.0,
            54.2,
            53.7
          ]
        },
        {
          "name": "tomato_half_cross.glb",
          "lod": 0,
          "bytes": 1317856,
          "triangles": 45812,
          "pieces": 2,
          "piece_mass_g": 74.87,
          "mass_total_g": 149.7,
          "piece_size_mm": [
            70.4,
            70.3,
            27.6
          ]
        }
      ],
      "piece_count": 2,
      "piece_mass_g": 74.72,
      "piece_size_mm": {
        "x": 65.0,
        "y": 54.2,
        "z": 53.7
      }
    },
    "quarter": {
      "status": "built",
      "files": [
        {
          "name": "tomato_quarter.glb",
          "lod": 0,
          "bytes": 1390420,
          "triangles": 47522,
          "pieces": 4,
          "piece_mass_g": 37.34,
          "mass_total_g": 149.4,
          "piece_size_mm": [
            54.1,
            37.2,
            35.3
          ]
        }
      ],
      "piece_count": 4,
      "piece_mass_g": 37.34,
      "piece_size_mm": {
        "x": 54.1,
        "y": 37.2,
        "z": 35.3
      }
    },
    "wedges": {
      "status": "built",
      "files": [
        {
          "name": "tomato_wedges.glb",
          "lod": 0,
          "bytes": 1520456,
          "triangles": 50733,
          "pieces": 8,
          "piece_mass_g": 18.68,
          "mass_total_g": 149.4,
          "piece_size_mm": [
            46.9,
            26.6,
            25.5
          ]
        }
      ],
      "piece_count": 8,
      "piece_mass_g": 18.68,
      "piece_size_mm": {
        "x": 46.9,
        "y": 26.6,
        "z": 25.5
      }
    },
    "slices": {
      "status": "built",
      "variants": [
        "thin",
        "medium",
        "thick"
      ],
      "files": [
        {
          "name": "tomato_slices_medium.glb",
          "lod": 0,
          "bytes": 2218760,
          "triangles": 67521,
          "pieces": 8,
          "piece_mass_g": 18.08,
          "mass_total_g": 144.7,
          "piece_size_mm": [
            65.3,
            65.1,
            9.2
          ]
        },
        {
          "name": "tomato_slices_thick.glb",
          "lod": 0,
          "bytes": 1795768,
          "triangles": 56753,
          "pieces": 4,
          "piece_mass_g": 36.86,
          "mass_total_g": 147.4,
          "piece_size_mm": [
            68.4,
            68.3,
            17.2
          ]
        },
        {
          "name": "tomato_slices_thin.glb",
          "lod": 0,
          "bytes": 3260576,
          "triangles": 93543,
          "pieces": 17,
          "piece_mass_g": 8.54,
          "mass_total_g": 145.3,
          "piece_size_mm": [
            63.0,
            62.5,
            4.4
          ]
        }
      ],
      "piece_count": 8,
      "piece_mass_g": 18.08,
      "piece_size_mm": {
        "x": 65.3,
        "y": 65.1,
        "z": 9.2
      }
    },
    "half_slices": {
      "status": "built",
      "files": [
        {
          "name": "tomato_half_slices.glb",
          "lod": 0,
          "bytes": 2448772,
          "triangles": 72943,
          "pieces": 18,
          "piece_mass_g": 8.34,
          "mass_total_g": 150.1,
          "piece_size_mm": [
            57.1,
            50.5,
            6.8
          ]
        }
      ],
      "piece_count": 18,
      "piece_mass_g": 8.34,
      "piece_size_mm": {
        "x": 57.1,
        "y": 50.5,
        "z": 6.8
      }
    },
    "strips": {
      "status": "built",
      "notes": "edge scraps under 0.35 cm3 are discarded, as a cook would",
      "files": [
        {
          "name": "tomato_strips.glb",
          "lod": 0,
          "bytes": 3596972,
          "triangles": 95518,
          "pieces": 57,
          "piece_mass_g": 2.62,
          "mass_total_g": 149.3,
          "piece_size_mm": [
            55.7,
            9.1,
            7.9
          ]
        }
      ],
      "piece_count": 57,
      "piece_mass_g": 2.62,
      "piece_size_mm": {
        "x": 55.7,
        "y": 9.1,
        "z": 7.9
      }
    },
    "cubes": {
      "status": "built",
      "files": [
        {
          "name": "tomato_cubes.glb",
          "lod": 0,
          "bytes": 3239376,
          "triangles": 84468,
          "pieces": 80,
          "piece_mass_g": 1.87,
          "mass_total_g": 149.3,
          "piece_size_mm": [
            16.4,
            14.4,
            10.9
          ]
        }
      ],
      "piece_count": 80,
      "piece_mass_g": 1.87,
      "piece_size_mm": {
        "x": 16.4,
        "y": 14.4,
        "z": 10.9
      }
    },
    "diced": {
      "status": "built",
      "notes": "representative set of pieces cut from one 7 mm slab; the app instances them to reach the grams",
      "files": [
        {
          "name": "tomato_diced.glb",
          "lod": 0,
          "bytes": 1607204,
          "triangles": 31848,
          "pieces": 82,
          "piece_mass_g": 0.31,
          "mass_total_g": 25.7,
          "piece_size_mm": [
            10.9,
            7.8,
            5.4
          ]
        }
      ],
      "piece_count": 82,
      "piece_mass_g": 0.31,
      "piece_size_mm": {
        "x": 10.9,
        "y": 7.8,
        "z": 5.4
      }
    },
    "chopped": {
      "status": "built",
      "notes": "representative set from one quadrant of a 3 mm slab; the app instances them",
      "files": [
        {
          "name": "tomato_chopped.glb",
          "lod": 0,
          "bytes": 797132,
          "triangles": 11170,
          "pieces": 106,
          "piece_mass_g": 0.03,
          "mass_total_g": 2.9,
          "piece_size_mm": [
            4.7,
            3.2,
            2.2
          ]
        }
      ],
      "piece_count": 106,
      "piece_mass_g": 0.03,
      "piece_size_mm": {
        "x": 4.7,
        "y": 3.2,
        "z": 2.2
      }
    },
    "mashed": {
      "status": "built",
      "variants": [
        "crushed",
        "puree"
      ],
      "files": [
        {
          "name": "tomato_mashed_crushed.glb",
          "lod": 0,
          "bytes": 1731068,
          "triangles": 39740,
          "pieces": 66,
          "piece_mass_g": 0.86,
          "mass_total_g": 57.0,
          "piece_size_mm": [
            13.7,
            9.1,
            4.6
          ]
        },
        {
          "name": "tomato_mashed_puree.glb",
          "lod": 0,
          "bytes": 245060,
          "triangles": 10848,
          "pieces": 1,
          "piece_mass_g": 144.91,
          "mass_total_g": 144.9,
          "piece_size_mm": [
            121.3,
            116.7,
            26.0
          ]
        }
      ],
      "piece_count": 66,
      "piece_mass_g": 0.86,
      "piece_size_mm": {
        "x": 13.7,
        "y": 9.1,
        "z": 4.6
      }
    },
    "peeled": {
      "status": "built",
      "files": [
        {
          "name": "tomato_peeled.glb",
          "lod": 0,
          "bytes": 126320,
          "triangles": 6240,
          "pieces": 1,
          "piece_mass_g": 139.79,
          "mass_total_g": 139.8,
          "piece_size_mm": [
            69.2,
            69.2,
            53.1
          ]
        }
      ],
      "piece_count": 1,
      "piece_mass_g": 139.79,
      "piece_size_mm": {
        "x": 69.2,
        "y": 69.2,
        "z": 53.1
      }
    },
    "cooked": {
      "status": "built",
      "variants": [
        "roasted",
        "stewed",
        "grilled"
      ],
      "notes": "fried: planned",
      "files": [
        {
          "name": "tomato_cooked_grilled.glb",
          "lod": 0,
          "bytes": 1353908,
          "triangles": 41606,
          "pieces": 3,
          "piece_mass_g": 31.38,
          "mass_total_g": 94.1,
          "piece_size_mm": [
            65.9,
            65.8,
            9.4
          ]
        },
        {
          "name": "tomato_cooked_roasted.glb",
          "lod": 0,
          "bytes": 1317780,
          "triangles": 45812,
          "pieces": 2,
          "piece_mass_g": 59.9,
          "mass_total_g": 119.8,
          "piece_size_mm": [
            63.5,
            63.4,
            25.0
          ]
        },
        {
          "name": "tomato_cooked_stewed.glb",
          "lod": 0,
          "bytes": 3247732,
          "triangles": 84468,
          "pieces": 80,
          "piece_mass_g": 1.59,
          "mass_total_g": 126.9,